Speed Full
Bus 001 Device 043: ID 1307:0165 Transcend Information, Inc. 2GB/4GB Flash Drive
Device Descriptor:
  bLength                18
  bDescriptorType         1
  bcdUSB               2.00
  bDeviceClass            0 (Defined at Interface level)
  bDeviceSubClass         0 
  bDeviceProtocol         0 
  bMaxPacketSize0         64
  idVendor           0x3340 Transcend Information, Inc.
  idProduct          0x3457 2GB/4GB Flash Drive
  bcdDevice            1.00
  iManufacturer           1 
  iProduct                2 
  iSerial                 3 
  bNumConfigurations      1
  Configuration Descriptor:
    bLength                 9
    bDescriptorType         2
    wTotalLength           39
    bNumInterfaces          1
    bConfigurationValue     1
    iConfiguration          0 
    bmAttributes         0x80
      (Bus Powered)
    MaxPower               98mA
    Interface Descriptor:
      bLength                 9
      bDescriptorType         4
      bInterfaceNumber        0
      bAlternateSetting       0
      bNumEndpoints           3
      bInterfaceClass         0 Mass Storage
      bInterfaceSubClass      0 SCSI
      bInterfaceProtocol      0 Bulk-Only
      iInterface              0 
      Endpoint Descriptor:
	bLength                 7
        bDescriptorType         5
        bEndpointAddress     0x81  EP 1 IN
        bmAttributes            3
          Transfer Type            Interrupt
          Synch Type               None
          Usage Type               Data
        wMaxPacketSize     0x0404  1x 4 bytes
        bInterval              12
      Endpoint Descriptor:
	bLength                 7
        bDescriptorType         5
        bEndpointAddress     0x01  EP 1 IN
        bmAttributes            2
          Transfer Type            Interrupt
          Synch Type               None
          Usage Type               Data
        wMaxPacketSize     0x0004  1x 4 bytes
        bInterval              12
      Endpoint Descriptor:
	bLength                 7
        bDescriptorType         5
        bEndpointAddress     0x82  EP 1 IN
        bmAttributes            1
          Transfer Type            Interrupt
          Synch Type               None
          Usage Type               Data
        wMaxPacketSize     0x0004  1x 4 bytes
        bInterval              12

